osm_type,osm_id,name,name:be,name:ru
node,3711934880,"Благотворительное католическое общество ""Каритас""","Дабрачыннае каталіцкае таварыства ""Карытас""",
way,543867394,Коссовский психоневрологический дом-интернат для престарелых и инвалидов,Косаўскі псіханеўралагічны дом-інтэрнат,
way,409057034,Куренецкий дом-интернат для престарелых и инвалидов,Куранецкі дом-інтэрнат для састарэлых і інвалідаў,
way,376079711,Отделение социальной адаптации и реабилитации,Аддзяленне сацыяльнай адаптацыі і рэабілітацыі,
node,3957843749,"группа Анонимных Алкоголиков ""Возрождение""","група Ананімных Алкаголікаў ""Адраджэнне""",
